{
  "schema_version": "1.0.0",
  "generated_at": "2026-10-19T12:00:00Z",
  "repository": "example-org/example-app",
  "head_sha": "abc1234deadbeef",
  "pr_number": 42,
  "findings": [
    {
      "engine": "semgrep",
      "rule_id": "javascript.lang.security.audit.detect-non-literal-regexp",
      "severity": "error",
      "category": "security",
      "path": "src/auth/validate.js",
      "start_line": 88,
      "end_line": 92,
      "message": "Non-literal RegExp can lead to ReDoS.",
      "remediation": "Use a literal pattern or an allowlisted safe constructor.",
      "in_pr_diff": true,
      "fingerprint": "semgrep:detect-non-literal-regexp:src/auth/validate.js:88"
    },
    {
      "engine": "jscpd",
      "rule_id": "duplication",
      "severity": "warning",
      "category": "duplication",
      "path": "src/utils/format.ts",
      "start_line": 10,
      "end_line": 40,
      "message": "New duplicated block (31 lines) also found in src/legacy/format.ts.",
      "remediation": "Extract shared helper or delete the duplicate.",
      "in_pr_diff": true,
      "fingerprint": "jscpd:src/utils/format.ts:10-40"
    },
    {
      "engine": "lizard",
      "rule_id": "cyclomatic_complexity",
      "severity": "warning",
      "category": "complexity",
      "path": "services/api/app/main.py",
      "start_line": 120,
      "end_line": 210,
      "message": "Function handle_request complexity is 18 (threshold 15).",
      "remediation": "Split into smaller functions before merge.",
      "in_pr_diff": true,
      "fingerprint": "lizard:handle_request:18"
    },
    {
      "engine": "coverage",
      "rule_id": "changed_file_coverage",
      "severity": "warning",
      "category": "coverage",
      "path": "services/api/app/main.py",
      "start_line": null,
      "end_line": null,
      "message": "Changed-file line coverage is 72% (threshold 80%).",
      "remediation": "Add unit tests for the new branches in this PR.",
      "in_pr_diff": true,
      "fingerprint": "coverage:services/api/app/main.py:72"
    },
    {
      "engine": "gitleaks",
      "rule_id": "generic-api-key",
      "severity": "error",
      "category": "secret",
      "path": "config/local.env.example",
      "start_line": 3,
      "end_line": 3,
      "message": "Possible API key committed in example env file.",
      "remediation": "Replace with a placeholder and rotate if the value was real.",
      "in_pr_diff": false,
      "fingerprint": "gitleaks:generic-api-key:config/local.env.example:3"
    }
  ]
}
